{
  "schema_version": "1.0.0",
  "feed_id": "market_matrix",
  "last_updated": "2026-10-29T13:46:23+09:00",
  "source": {
    "label": "Atlas DataLake market-grid（事実品質ゲート適用）",
    "disclaimer_ja": "本ページの数値は Atlas DataLake の業種別調査ノートからの二次加工です。投資・経営判断は自己責任でお願いします。"
  },
  "meta": {
    "countries": [
      {
        "iso2": "CN",
        "name_ja": "中国",
        "name_en": "China"
      },
      {
        "iso2": "TH",
        "name_ja": "タイ",
        "name_en": "Thailand"
      },
      {
        "iso2": "VN",
        "name_ja": "ベトナム",
        "name_en": "Vietnam"
      },
      {
        "iso2": "US",
        "name_ja": "米国",
        "name_en": "United States"
      },
      {
        "iso2": "TW",
        "name_ja": "台湾",
        "name_en": "Taiwan"
      },
      {
        "iso2": "KR",
        "name_ja": "韓国",
        "name_en": "Korea"
      },
      {
        "iso2": "ID",
        "name_ja": "インドネシア",
        "name_en": "Indonesia"
      }
    ],
    "industries": [
      {
        "industry_id": "medical-devices",
        "name_ja": "医療機器",
        "name_en": "Medical devices"
      }
    ],
    "coverage_note_ja": "Phase 2 初回は「医療機器（medical-devices）」1 業種 × 7 か国のみ。他業種は事実品質ゲートで保留（詳細は excluded_note）。",
    "excluded_note_ja": "以下は tags:[market-size] があるが、同一国の複数業種セルで同じ集計値が 転用されているため B1 には含めていない（業種特化データではないため）：①インド cosmetics/snacks-confectionery/food-beverage/foodtech/home-appliances/health-food/daily-goods の7業種＝全て「インド FMCG 市場全体」の同一数値を転用。②韓国 cybersecurity/telecom-5g/content-entertainment の3業種＝全て「韓国 ICT 市場全体」の同一数値を転用。③各国の pharma-biotech セルの多くが同国の medical-devices セルと同一数値（データ生成時の未分化）。→ Phase 3 で業種特化ファクトへの格上げが必要（DataLake α層バックフィル対象）。"
  },
  "modules": {
    "B1_market_size": {
      "module_id": "B1",
      "title_ja": "業種×国 市場規模マトリクス",
      "title_en": "Industry x country market size matrix",
      "last_updated": "2026-10-29T13:46:23+09:00",
      "source": {
        "label": "Atlas DataLake market-grid"
      },
      "cells": [
        {
          "iso2": "CN",
          "industry_id": "medical-devices",
          "market_size_usd": 140000000000,
          "market_size_year": 2025,
          "cagr_pct": null,
          "cagr_period": null,
          "veritas": "✅",
          "cell_path": "prove/market-grid/china/medical-devices/cell.yaml",
          "metric_ids": [
            "market.size.value_usd"
          ],
          "note_ja": "中国 medtech 市場 世界2位（米国に次ぐ）。VBP・バイチャイナで価格圧迫進行中。",
          "source_ja": "中国産業データ（β深掘り・cell.yaml C1_market）"
        },
        {
          "iso2": "TH",
          "industry_id": "medical-devices",
          "market_size_usd": 7000000000,
          "market_size_year": 2024,
          "cagr_pct": null,
          "cagr_period": null,
          "veritas": "✅",
          "cell_path": "prove/market-grid/thailand/medical-devices/cell.yaml",
          "metric_ids": [
            "market.size.value_usd"
          ],
          "note_ja": "ASEAN第2位。輸入依存度80%超。メディカルツーリズム拠点（年350万人）。",
          "source_ja": "タイ産業データ（β深掘り・cell.yaml C1_market）"
        },
        {
          "iso2": "VN",
          "industry_id": "medical-devices",
          "market_size_usd": 2300000000,
          "market_size_year": 2024,
          "cagr_pct": 10.0,
          "cagr_period": "2023-2024",
          "veritas": "✅",
          "cell_path": "prove/market-grid/vietnam/medical-devices/cell.yaml",
          "metric_ids": [
            "market.size.value_usd",
            "market.cagr.pct"
          ],
          "note_ja": "ASEAN最高成長率。輸入依存度90%超（ASEAN最高）。",
          "source_ja": "Asia Actual / GBI Vietnam"
        },
        {
          "iso2": "US",
          "industry_id": "medical-devices",
          "market_size_usd": 190000000000,
          "market_size_year": 2024,
          "cagr_pct": null,
          "cagr_period": null,
          "veritas": "✅",
          "cell_path": "prove/market-grid/usa/medical-devices/cell.yaml",
          "metric_ids": [
            "market.size.value_usd"
          ],
          "note_ja": "世界最大（世界市場の40%）。範囲値 USD 1,800-2,000億の中央値。",
          "source_ja": "AdvaMed / Frost & Sullivan US Medtech 2025"
        },
        {
          "iso2": "TW",
          "industry_id": "medical-devices",
          "market_size_usd": 3900000000,
          "market_size_year": 2024,
          "cagr_pct": 5.5,
          "cagr_period": "annual",
          "veritas": "✅",
          "cell_path": "prove/market-grid/taiwan/medical-devices/cell.yaml",
          "metric_ids": [
            "market.size.value_usd",
            "market.cagr.pct"
          ],
          "note_ja": "範囲値 USD 38-40億の中央値。輸入依存度60%超。",
          "source_ja": "ITRI / 経済部工業局"
        },
        {
          "iso2": "KR",
          "industry_id": "medical-devices",
          "market_size_usd": 9750000000,
          "market_size_year": 2025,
          "cagr_pct": 7.0,
          "cagr_period": "annual",
          "veritas": "✅",
          "cell_path": "prove/market-grid/korea/medical-devices/cell.yaml",
          "metric_ids": [
            "market.size.value_usd",
            "market.cagr.pct"
          ],
          "note_ja": "範囲値 USD 95-100億の中央値。輸入依存度約70%。美容医療輸出世界No.1。",
          "source_ja": "KMDIA / Frost & Sullivan"
        },
        {
          "iso2": "ID",
          "industry_id": "medical-devices",
          "market_size_usd": 8000000000,
          "market_size_year": 2024,
          "cagr_pct": null,
          "cagr_period": null,
          "veritas": "✅",
          "cell_path": "prove/market-grid/indonesia/medical-devices/cell.yaml",
          "metric_ids": [
            "market.size.value_usd"
          ],
          "note_ja": "ASEAN第1位（人口2.8億）。輸入依存度90%超。",
          "source_ja": "Krungsri Research / MedDeviceGuide"
        }
      ]
    }
  }
}
